1972	Lenin in Budapest	Bálint Szombáthy	By carrying a poster of Lenin – the leader of the Bolshevik Revolution of 1917 – through Budapest, the artist revealed the socialist revolution as at the same time a lost dream and a society on which the bureaucratic order of the party was imposed; marks the break of artists with the socialist utopia by displaying its icons in the trivial everyday life of "actually existing socialism." 
1972	The Limits to Growth	Club of Rome	Based on computer simulation, this study tried to forecast the effects of exponential growth on a world of limited resources. It triggered a debate about natural limits to unrestrained economic development and its impact on the environment. The report represents the growing ecological consciousness in Western industrial countries. 
1972	Watergate		The arrest of five burglars in the headquarter of the Democratic Party in the Watergate building complex led to revelations about widespread abuse of power by president Richard Nixon, including secret wiretapping at the White House. Drawing on an anonymous source called Deep Throat, investigative reporters followed the money trail to the top of the Nixon administration. This led to widespread distrust of the American political establishment and a crisis of legitimacy.
1973	Audiovisual Messages	Trigon Festival	The exhibition, shown as part of Trigon festival, was the first large scale exhibition in central Europe dedicated to artists working with video. With specially commissioned works by, among others, Gianni Colombo, Sania Iveković, Dalibor Martinis, Nusra and Sreco Dragan.   
1973	Black-Scholes-Merton model (BSM)	Fisher Black, Myron Scholes, Robert C. Merton 	Its mathematical equation gives the theoretically risk-free price for an option. Probability theory applied to betting on market movements changed the attitude towards derivatives from immoral gambling to a scientific and rational activity. Even though the model's hypothesis was falsified during the 1987 market crash, Scholes and Merton received the Nobel Prize in Economics in 1997 (Black had died before). BSM had to be calculated on a computer, which initially impeded its use on trading floors. When Joseph Ritchie programmed the formula into a hand-held calculator (1975), it became the paradigmatic tool every trader still uses. 
1973	Chicago Board Options Exchange (CBOE)		The CBOE is the first marketplace for trading listed options. After the end of Bretton Woods, hedging and speculation became the new business model for managing risk and price expectations. Information was crucial, which led to computerization and new institutions (marketplaces). This initiated a growth in derivative markets, products and models that is ongoing.
1973	End of Bretton Woods 		After the abandonment of the gold standard, the pegging of currencies to the U.S. dollar was ended for good. Currencies became free floating and exchange rates volatile. This prompted the development of new risk management methods. Derivative markets proliferated due to a mindset that saw speculation as inherent to free markets.
1973	Filosofía de la liberación	Enrique Dussel	The philosophy of liberation – a book title as well as a collective effort in the name of liberation, autonomy and authenticity – is a major strand within post-colonial discourse. It aims to think the distinct world historical character of Latin America out of economic, cultural, political dependency. It is a critique of imperialism, colonialism, globalization, racism, and sexism articulated from the experience of exploitation, destitution, alienation, and reification. According to Dussel, there will be no future apart from the liberation of the periphery.
1973	OPEC Oil Crisis		In response to American-led Western support for Israel in the Yom Kippur War, the Organization of Oil Exporting Countries enacted an oil export embargo. This exacerbated an already looming crisis of Keynesian Fordism, prompting the intensification of a paradigm change towards neoliberalism. The event also marked the beginning of a rising influence of a radical form of Islam from Saudi Arabia.
1973	Post-Industrial Society	Daniel Bell	Influential book arguing that a shift towards information processing is transforming economy, politics and culture in Western societies. 
1973	Remote Frequency Identification (RFID)		Two key patents for modern Radio Frequency Identification technology granted in the US. RFID became a key infrastructure for global logistics and real time tracking of objects, animals and humans (for example, through ankle monitors).
1973	Television Delivers People	Richard Serra	A short film made by artist Richard Serra. Working alongside Carlota Fay Schoolman, the two artists bought some airtime to broadcast the piece to the public. The text of this piece of video art is a critique of mass media and pop culture as a control tactic and social construct.
1974	Autobahn	Kraftwerk	The first of a series of recordings by the German band Kraftwerk which pioneers a new synthetic musical style using synthesizers, drum machines and a purpose-built vocoder. They deeply influenced New Wave synthesizer music, Hip Hop, Electro, House and Techno Music. 
1974	Petrodollars		In 1974 a USA-Saudi alliance fixed the dollar as the only currency for oil trade in the OPEC system. This, in combination with the high oil prices, increased the amount of free floating capital, the so-called "petrodollars", which were channeled into loans by US banks for emerging economies, thus contributing to the global finance system.
1974	Recombinant DNA	Stanford University	The patent application of Stanford University for recombinant DNA marks a turning point: rDNA allows for the moving of sequences of genetic information across the barriers of species and genus.
1974	Relational Database (SQL)		In 1974 the first specification for SQL (Structured Query Language) was published. SQL is the leading technology behind the "database revolution" (Big Data) as well as a basis of data storage and retrieval in the 21st century.
1974	The Internet Protocol Suite (TCP/IP)	Vint Cerf, Bob Kahn	Transmission Control Protocol and Internet Protocol (TC/IP) is a suite of protocols that form the technological core of the Internet. The layered architecture of those protocols ensures the net's capacity for decentral self-organisation and its neutrality (data packets are passed on regardless of content or destination).
1974	Universal Product Code on Barcodes		The (optical) Universal Product Code on barcodes was created by IBM consultant George Laurer. It followed the introduction of the first barcode scanner in 1972 and together with the container it effected a global revolution in logistics.
1975	Angola and Mozambique Independence		After close to 500 years of Portuguese rule, these two territories gain formal independence. This marks the end of European colonialism as formal political system.
1975	Fristenlösung (Legal Abortion) in Austria 	AUF (Aktion Unabhängiger Frauen), SPÖ (Social Democrats)	In 1973 abortion became legalized in Austria under certain conditions. This right of control over their own body was hard fought for by women and continues to be controversial in some countries.
1975	Genetic Algorithms	John Holland	This book established the field of genetic algorithms. Today, they play an important role in studies of complex adaptive systems. Applications range from adaptive agents in economic theory to machine learning techniques used in the design of complex technologies and Big Data processing. 
1975	New York City Bankruptcy		The city administration was forced into a technical bankruptcy when it found itself unable to refinance its debt. The conditions of the bailout forced a restructuring of the public institutions, curbing the power of unions, introducing tuition fees at public colleges and dismantling the welfare state. This served as a template for neo-liberal policies around the world.
1975	Semiotics of the Kitchen	Martha Rosler	In this video, Rosler works herself through an alphabet of expressions relating to the kitchen, whereby she "replaces the domesticated 'meaning' of tools with a lexicon of rage and frustration." The piece has become an icon of feminist video art.
1975	World Population: 4 Billion people   		A family planning initiative during the “Indian Emergency” of  1975-77 triggered one of the biggest controversies in population politics. Operating with sterilization quotas that local authorities had to meet, it led to widespread compulsory sterilization. The resulting backlash remains a huge burden for all programs aiming at limiting population growth in India and elsewhere for decades to come. 
1976	Animal Liberation Front	Ronnie Lee	An international, clandestine, leaderless resistance engaging in illegal direct action in pursuit of animal rights. Activists see themselves as a modern-day Underground Railroad, removing animals from labs and farms, destroying facilities, arranging safe houses and veterinary care, and operating sanctuaries where the animals subsequently live. It marks a major radicalization in the animal rights movement and a new type underground organisation, rejecting centralized leadership and command. 
1976	Apple Inc.	Steve Jobs, Steve Wozniak	Apple computer company, now Apple Inc., was founded on April 1. Its first product, the Apple I, was a computer kit, designed and hand-built by Wozniak. Apple became successful by taking care of the creative side of computing, offering one of the first GUIs and pioneering applications for desktop design and graphic design.
1976	Karnataka State Electronics Development Corporation (Keonics)	Ram Krishna Baliga	With the establishment of Keonics by the the chief minister of the Indian state of Karnataka, the vision of turning Bangalore into the "Silicon Valley of India" (Baliga) found offical support and the "Electronics City" was established as the first hub of IT development. With the liberalization of the Indian economy in the 1990s, Bangalore grew into one of the leading hubs for outsourced IT services.
1976	Post Partum Document I	Mary Kelly	The work grew out of Kelly's engagement with feminism, psychoanalysis and women groups and art. The piece consists of a six year exploration of the child-mother relationship and combined written text with stained baby nappies. When shown at the ICA, it caused an outrage in tabloid media. The work was of lasting influence on post-conceptual art.
1977	 Tape-bow violin	Laurie Anderson	Anderson is a pioneer in electronic music and has invented several devices that she has used in her recordings and performance art shows. In 1977, she created a tape-bow violin that makes use of recorded magnetic tape on the bow instead of horsehair and a magnetic tape head in the bridge.
1977	In Vitro Fertilization (IVF)	Robert Edwards, Patrick Steptoe      	The world's first successful outside the body conception which resulted in the birth of Louise Brown on 25 July 1978, in Greater Manchester, UK. Since then IVF has changed the relation to our body, to sex, reproduction and the meaning of kinship and family. In some countries almost 5 percent of the population are conceived by "Assisted Reproduction Technology".
1977	Radio Alice		Free radio station in Bologna, stormed by police in 1977 while on air. Connected to the autonomist political movement and free radio movement, it's exemplary for the idea of a "molecular media revolution" from below.
1977	Satellite Arts Project	Kit Galloway and Sherrie Rabinowitz	First time use of satellites in art. The artists produced composite images of participants with the support of NASA, enabling an interactive dance concert amongst geographically disparate performers. These first satellite works emphasized the primacy of process that remained central to the theory and practice of telematic art. In 2000, Helen V. Jamieson terms "cyberperformance" a new art genre whose history she traces back to the Satellite Arts Project.
1977	Stammheim Deaths: End of First Phase of RAF		On October 18 1977, the suicide of Jan Carl Raspe, Gudrun Ensslin and Andreas Baader – leading members of the first wave of the urban guerrilla group Red Army Faction – in Stammheim high security prison was reported. This event marked a significant historical shift in the self-understanding of the German Left.
1978	Chinese Economic Reform 	Deng Xiaoping	The Chinese Economic Reform program was launched. It gradually introduced capitalist market economy policies while political power remained in the hands of the Communist party. China became the industrial workshop of the world, which triggered prolonged high economic growth rates, mounting ecological damage and the diminuation of labour power in the West.
1978	IBM (song title)	Throbbing Gristle	The Industrial Music pioneers use modem noises and other electronic sounds for their piece IBM, first track on their second album "Death on Arrival, The Third and Final Report."
1978	Orientalism	Edward Said	Major study that launched "post-colonial studies" as a field, challenging the Western bias on the Humanities and Social Sciences.
1978	Technology/Transformation: Wonder Woman	Dara Birnbaum	In the remix work she uses appropriated images of Wonder Woman to subvert the ideology and meaning embedded in the television series. 
1978	Zwentendorf referendum		Construction of the first Austrian nuclear power plant began 1972. A broad grass roots movement campaigned against the project and succeeded in demanding a referendum in 1978. A little over 50% voted against the use of nuclear power in Austria. This fostered the concept of the "Bürgerinitiative", a new form of citizen activism.
1979	Ars Electronica Festival	Hannes Leopoldseder, Hubert Bognermayr, Herbert W. Franke, Ulrich Rützel, Gottfried Hattinger	The beginning of a new, second wave of media art and digital art practices based on the availability of PCs and consumer electronics. Ars Electronica rapidly achieved worldwide attention as one of the biggest festivals to deal with the artistic possibilities and social consequences of digital technology. Based in Linz, the former industrial town tried to make use of this cultural capital and turn itself into an information economy centre.  
1979	Dragnet Investigation (Rasterfahndung)		In 1979 the German police arrested the RAF terrorist Rolf Heißler following the first successful use of the method of "Rasterfahndung" or dragnet investigation, based on computer based pattern recognition of a huge amount of individual electricity bills. This method is a precursor to present day Big Data criminal investigations.
1979	European Monetary System, EMS	EC member countries 	The European Monetary System became effective on March 19, and with some modifications, was operated in its original form until the beginning of the European Monetary Union on January 1, 1999. The EMS constituted an important intermediary step towards European Monetary Union.
1979	Gaia	James Lovelock	Introduction of the "Gaia hypothesis" conceptualising that living and non-living parts of the Earth form a complex interacting system that can be thought of as a single organism. Major influence on the ecological movement and on the development of thinking in complex systems.
1979	Iranian Revolution		The Iranian Revolution started out as a broad resistance against the Shah. After the return of Ayatollah Khomeini to Iran, the revolution was taken over by Islamic forces who built a revolutionary Islamic Republic. It was the first revolution of the 20th century that was not modelled on Western ideals.
1979	NATO Double-Track Decision	NATO	This policy led to the installation of nuclear missiles on German territory, which in turn galvanized the peace movement and contributed to the formation of the German Green Party.
1979	Three Miles Island nuclear accident		On March 28, the first major nuclear accident occurred at this Pennsylvania power plant. A first turning point in the global development of nuclear power, halting the rapid expansion which took place between the 1960s and 1970s.
1980	Green Party Germany		On January 13, the Green Party was founded. 1983 it won the first seats in the Bundestag, establishing a left-wing politics not tied to industrialism.
1980	Laibach		The concept pop group Laibach gets founded in Trbovlje, Slovenia. The use of the German name Laibach for the capital Ljubljana and the graphical language of the posters incite strong antagonistic reactions by the state. After a relaunch in 1982 Laibach become an internationally successful pop group which practices a detournement – a re-appropriation which changes the meaning and significance – of rock and pop songs such as Life is Life or Sympathy for the Devil.
1980	McBride Report: New World Order of Information and Communication	Séan MacBride and UNESCO	A UNESCO study on the effects of new communications media on the economy and on political participation. It established "communication justice" as a new theme in negotiations about international development. Critical line taken by report angered US government; pretext for stopping financial contributions to the UN.
1980	Rhizome	Gilles Deleuze, Félix Guattari	Among other important contributions in post-structural thinking, the book Milles Plateaux (A Thousand Plateaux) offered a template for the understanding of the internet. Deleuze and Guattari use the terms "rhizome" and "rhizomatic" to describe theory and research that allows for multiple, non-hierarchical entry and exit points in data representation and Interpretation.The term is lifted from biology and used in opposition to the arborescent (hierarchic, tree-like) conception of knowledge.
1980	Shenzhen Special Economic Zone		The creation of the first Special Economic Zone in Shenzhen, which was then a fishing village, provided the foundations for the export oriented Chinese economic miracle. It coincided with reforms in foreign exchange designed to open up the country for more investment and exchange.
1980	The Bayh-Dole Act, USA	Birch E. Bayh, Jr.; Bob Dole	After years of disinterest in patent law and in response to perceived economic stagnation the US Senate passed a law that allowed private capital to patent developments that have originated in federally funded projects both from The Defense Department via RAND and Los Alamos and also NASA. 
1980	Third Wave	Alvin Toffler	This book popularized the idea of a profound social change related to computers, justifying the attack on unions and social welfare state as standing in the way of inevitable and desirable progress.
1980	Usenet		The Usenet is often dubbed the precursor of the Internet and started in 1980 as a technology to browse and post "articles" (news) in categories ("newsgroups"). 
1981	Air Traffic Control Strike	Ronald Reagan	On August 5 1981 Ronald Reagan fired 11.000 air traffic control workers who had just begun a strike for better pay. This new tough line "signalled an all-out assault on the powers of organized labour", marking the start of the decline for the labour movement, an event of similar significance as the British Miners strike.
1981	Chaos Computer Club	CCC, Wau Holland	The German hacker organization Chaos Computer Club (CCC) was founded in Berlin (West) in the offices of the newspaper taz. It became the largest such organisation in the world and was soon recognized an independent center of competence in socio-technical debates.
1981	Ecstasy (MDMA)		Although MDMA had been first synthesized by chemical company Merck in 1912, it only became more widely known and used after it was nicknamed Ecstasy in 1981 and became the party drug of choice in the house and rave party scene of the 1980s. Its relatively mild effects producing euphoria and a sense of harmony make it the 'soma' of the information age.
1981	HIV/AIDS		First discovery of Human Immunodeficiency Virus infection and Acquired Immune Deficiency Syndrome. The virus developed in Western Africa in the early 20th century and came to the US in the 1960s where initially it spread mainly among gay men and injecting drug users. Now, Sub-Saharan Africa is the world's most affected region with 68 % of all cases.
1981	MS-DOS	Microsoft	Microsoft Disk Operating System developed by Microsoft from a request in 1981 by IBM for an operating system to use in its IBM PC range of personal computers.
1981	The Bloomberg Terminal	Bloomberg L.P.	Computer system that offers real-time market data to monitor, analyse and place trades on an electronic platform as well as news feeds, price quotes and messaging worldwide. A major jump in information distribution, it was quickly adopted by investment banks and brokerages. The 3-6 monitor terminals have become the iconic object of finance in movies and news reports. Today, over 300.000 professionals subscribe to the service.
1981	The Volcker Shock	Paul Volcker	The Federal Reserve Bank raised the interest rate to 20% to fight inflation. The "Volcker shock" sent the unemployment rate to above 10%, thus weakening unions. Borrowing money became more expensive, also for other countries whose currency was denominated in US dollars. Mexico was forced into default in 1982. This neoliberal turn effectively ended Keynesian policies 
1981	True Names: And the Opening of the Cyberspace Frontier	Vernor Vinge	Science fiction novella by Vernor Vinge, considered a seminal work of the cyberpunk genre. It is one of the earliest stories to present a fully fleshed-out concept of cyberspace, which would later be central to cyberpunk. The story also contains elements of transhumanism, anarchism, and hints about The Singularity.
1982	"Planet Rock" by Afrika Bambaataa and the Soul Sonic Force	Kevin Donovan aka Afrika Bambaataa 	Taking inspiration from the Black Consciousness Movement, Sun Ra, Kraftwerk, Yellow Magic Orchestra and DJ Kool Herc, a new musical style was created, electro, and with the Zulu Nation a movement for black emancipation. Traveling extensively, Bambaata took hip hop and electro to the French banlieues. 
1982	"Rock It" by Herbie Hancock 	Herbie Hancock	This track by former Jazz legend Herbie Hancock combines drum machines, synthesizers and scratching to create a foundational piece for the genre of electro. The video clip released a year later uses robots by artist Jim Whiting to celebrate alienation and artificiality.
1982	Blade Runner	Ridley Scott	A modified film adaptation of Philip K. Dicks "Do Androids Dream of Electric Sheep" in which a detective hunts replicants of humans who defied a ban on returning to earth; a paradigmatic movie both because of its story-line about artificial humans and animals as well as the retro-futuristic depiction of Los Angeles. 
1982	Financial Deregulation	Reagan Administration	The Garn-St. Germain Depository Institutions Act was part of the first wave of financial deregulation, instigating an ever-expanding financialization of the economy, centering around real estate.
1982	The World in 24 Hours	Robert Adrian	World-wide 24 hour telecommunications project conceived by Robert Adrian for Ars Electronica '82, Linz. Artists and groups contributed from15 cities around the world (Vienna, Frankfurt, Amsterdam, Bath, Wellfleet, Pittsburgh, Toronto, San Francisco, Vancouver, Honolulu, Tokyo, Sydney, Istanbul, Florence and Athens).
1982	Tron (movie)	Steven Lisberger (writer / director)	Movie that transports its main actors inside a computer game world; originally intended to be a fully computer animated film, it created an immersive video game reality by a mix of animation techniques.
1983	Able Archer 83. Nuclear Warfare Simulation	NATO	The exercises simulated a conflict escalation, culminating in a simulated DEFCON 1 coordinated nuclear attack. The realistic nature of the exercise led the Soviet Union to ready their nuclear forces. The apparent threat of nuclear war ended with the conclusion of the exercise on November 11.
1983	GNU Project, Free Software	Richard Stallman	Caught up in the absurd consequences that the process of commodification produced in the software field, Richard Stallman responded 1983 with the launch of the GNU project. 1985 Stallman founded the FSF. The broader FLOSS movement successfully implemented an alternative mode of software production.
1983	Lorna	Lynn Hershman Leeson	Lorna was the first interactive video art disc. Users interact with and make choices for the protagonist, Lorna, an agoraphobic woman. Every object in Lorna’s tiny apartment has a number that when pressed, access sound and video information about Lorna’s fears and dreams as well as her personal history, conflicts and future. The artist successfully transposed methods of feminist media art of the 1970s into the digital realm. 
1984	Apple Macintosh Superbowl Commercial	Apple Computers	The TV commercial created by Apple Computers for the new Apple Macintosh presents creative personal computing, represented by a young female athlete, shattering an Orwellian 1984-type society. 
1984	Battle of Orgreave	Margarete Thatcher vs British Miners Union	On June 18, some 5000 union members were confronted by an unprecedented number of police, which forcefully prevented them from picketing a British Steel cooking plant. This event was a turning point in the battle between Margaret Thatcher, who pursued neo-liberal policies and unions who pursued Keynesian or socialist policies. The unions were decisively beaten.
1984	Bhopal Disaster	Union Carbide	Considered the world's worst industrial desaster, a gas leak at the Union Carbide pesticide plant at Bhopal, India, caused an exothermal reaction that affected over 500,000 people, killing thousands. Union Carbide never accepted responsability for the catastrophe but in a settlement reached in 1989 agreed to pay for damages caused in the disaster.
