1984	DNA Profiling		DNA Profiling (also: DNA fingerprinting or DNA testing) was first developed in 1985 to be used in parentage testing, criminal investigation, etc. A paper about DNA fingerprinting was written by geneticist Alec Jeffreys and his team and was published in Nature in March 1985.
1984	Neue Slowenische Kunst (NSK)		The music group Laibach, the visual arts group Irwin and the theater and performance group Scipion Nasice Sisters Theatre founded NSK to carry out the task of the analysis of the relation between ideology and culture. NSK used and appropriated icons of modern art and political discourse as a kind of "tactical use of semiotic systems and visual codes", thereby successfully shaping the artistic discourse of the postmodern 1980s.
1984	Neuromancer	William Gibson	Gibson has coined the term “cyberspace” in his novelette “Burning Chrome”, published in 1982. However, it was only through its use in Neuromancer that the term cyberspace gained enough recognition to become the de-facto synonym for the World Wide Web during the 1990s.
1984	Occupation of Hainburger Au		The occupation of Hainburger Au, wetlands next to the river Danube to the south-east of Vienna, became a foundational moment for the environmental movement in Austria. It demonstrated to many that grassroots resistence did matter.
1984	Order out of Chaos	Ilia Prigogine, Isabell Stengers	Introduced ideas of complexity, path dependence and unstable equilibrium as scientific concepts and general metaphors into the wider discourse. Important influence on ideas such as complexity and self-organisation.
1985	“A Cyborg Manifesto: Science, Technology, and Socialist-Feminism in the Late Twentieth Century”	Donna Haraway	This influential essay criticizes traditional notions of feminism, particularly feminist focuses on identity politics, encouraging instead coalitions through affinity. The author uses the metaphor of the cyborg to urge feminists to move beyond the limitations of traditional gender, feminism, and politics.
1985	Avatar	Richard Garriott	The use of the term avatar for the on-screen representation of the user was coined in 1985 by Richard Garriott for the computer game Ultima IV: Quest of the Avatar. The word avatar originates in Hinduism, where it stands for the “descent” of a deity in a terrestrial form. (Deities in India are popularly thought to be formless and capable of manifesting themselves in any form.)
1985	Chicago House	Jesse Saunders, Mr. Fingers, Frankie Knuckles	Musicians in Chicago created an original urban dance music style combining influences from disco, salsoul, Yellow Magic Orchestra and Kraftwerk using drum machines, synthesizers and sampling. Early tracks were mainly produced for an African American gay underground scene at places such as The Warehouse. It arguably became the most successful urban electronic dance music of the information age.
1985	Detroit Techno		After an early single called "Cybotron", Detroit techno proper began in 1985 – with musicians and producers such as Juan Atkins, Kevin Saunderson and Derrick May producing the soundtrack of dark urban paranoia turned into hedonistic fun, more technoid and less melodical than house. Later groups such as Inner City and in particular Urban Resistance consciously promoted techno as a form of black liberation through technology.
1985	Digital Money	David Chaum	This paper delineates a system configuration for digital money. It is said to be the basis of the cypherpunk movement which advocates widespread use of strong cryptography as a route to social and political change; in the long run, it inspired the cryptocurrency Bitcoin (2009).
1985	Justice for Janitors (Organizing)		Neoliberal reshuffling of the service industries and a decline of traditional labor organization prompted a new type of trade unionism, called organizing. Activists work with affected workers to devise media-savvy strategies, broad alliances and disruptive practices. Has been spread to UK ("justice for cleaners") and Germany (verdi service sector union).  
1985	Les Immatériaux	Jean-Francoise Lyotard	The philosopher Jean Francoise Lyotard curated together with the Thierry Chaput the exhibition Les Immatériaux, Centres Georges Pompidou, March 28 to July 15, 1985. The postmodern philosopher as curator presented scientific artifacts and works of art side by side in an eccentric exhibition architecture that stressed immateriality as the new "material" of both art and philosophical thought.
1985	Option Markets	John C. Cox, Mark Rubinstein  	A milestone in quantitative finance, the "Cox Rubinstein" is the "bible" of derivative traders. It allows for the computation of option prices based on binomial trees (a subfield of probability theory) with an approach that is comparatively simple in contrast to the Black-Scholes-Merton model.
1985	Rainbow Warrior (bombing)   		When the Greenpeace flagship anchored in Auckland, New Zeeland, preparing a "Peace Flotilla" to protest and obstruct nuclear testing in Mururoa, it was blown up by French Secret Service agents. One crew member, the photographer Fernando Pereira, was killed.The incident led to serious diplomatic complications and highlighted the growing importance of NGO players on the international stage.
1985	The last "colder than average" month	 	February 1985 was the last time the planet saw a colder-than-average month.
1985	The Plaza Accord	Reagan Administration	An agreement that forced Japan and Germany to accept a devaluation of the dollar against the yen and the Deutschmark. With this agreement, the USA used political muscle to force their allies to accept economic policies harmful to themselves, in particular putting an end to the rise of Japan to become the No.1 economic superpower 
1985	The WELL - Whole Earth 'Lectronic Link'	Stuart Brand, Larry Brilliant	The WELL is known as the world's first and most influential online community. It started as a dial-up bulletin board system (BBS) in 1985 around writers and readers of the Whole Earth Catalog. The experience on The WELL inspired Howard Rheingold to coin the term "Virtual Community".
1986	Big Bang: London Stock Exchange 	Margaret Thatcher	Deregulation of the financial markets and introduction of new technologies for computerized trading, taking effect on October 28. This sparked an expansion of financial markets that, in spite of the global financial crisis in 2008, still continues.
1986	Chernobyl disaster		On April 28, the nuclear power plant exploded in the Ukraine, releasing large quantities of nuclear radition, spreading over the USSR and Western Europe. This gave a major boost to the environmental movement and the Green political parties.
1986	First use of DNA fingerprinting in a criminal investigation		Richard Buckland was the first person to be exonerated for a crime using DNA fingerprinting.
1986	Perestroika / Glasnost	Mikhail Gorbachev	Gorbachev, then head of state of the Soviet Union, tried to initiate economic  and social reforms to revive the stagnating economy. According to Manuel Castells, the old "industrialism" had fallen into a crisis in the early 1970s in the East and the West, for mostly the same reason (growing complexity). While the West was able to develop "informationalism" as a new mode of production, the Soviet reforms failed and the Union collapsed by the end of the decade.
1986	Society of Mind	Marvin Minsky	In his book and theory Minsky introduced the term agent. Agents can be connected and composed into larger systems called 'societies of agents'. Together, societies of agents can perform functions more complex than any single agent could, and ultimately produce the many abilities we attribute to minds. 
1986	Special Purpose Vehicles (SPV)	Michael Milken et al.	When US tax rule permitted the tranching of credit risk, the separation of risk with Collateral Debt Obligations (CDOs) began to proliferate. Firms created legal entities commonly registered in tax havens, so-called Special Purpose Vehicles (SPV) that allow tax avoidance by hiding ownership and debt. As a result, they are tied to some of the most notorious scandals of the last 30 years, such as Michael Milken’s junk-bond fraud (1980s), the Enron scandal (early 2000s), and the subprime mortgage meltdown (2007-08).
1986	Wackersdorf Nuclear Reprocessing Plant	Franz Josef Strauss	Attempts to build a nuclear reprocessing plant in Wackersdorf, Bavaria, lead to massive protests which become formative for a whole generation.
1987	Black Monday		Spreading from Hong Kong, the market crash hit the USA on October 19 and triggered the largest one-day decline in the history of the Dow Jones Index. The widespread application of computerized risk-assessment and diversification models inadvertently introduced a new kind of risk into the financial markets by producing false prices for rare events.
1987	First Intifada		Uprising by unarmed Palestinian youths throwing stones, against the occupation of the Westbank and Gaza strip. It triggered massive investments in Israeli military technology for asymmetric urban warfare.
1987	Information Visualization	SIGGRAPH	This issue of Computer Graphics magazine laid the ground for what is today most often referred to as Information Visualization, the computer supported "study of (interactive) visual representations of abstract data to reinforce human cognition", today considered one of the pillars of Big Data analytics.
1987	Istanbul Biennial		This biennial, situated at the border between Europe and Asia, has established itself as an early and important node in the globalization of contemporary art.
1987	Volatility Smile		The "Volatility Smile" is a pattern in the pricing of financial derivatives. It first appeared with the 1987 crash due to the failure of the Black Scholes model to calculate prices for low probability events ("fat-tails"). It is a prime cause for the reevaluation of the model and has become a constant in financial modeling.
1987	World Population: 5 Billion people		Average annual rate of population change  in the period 1985-90: 1,80% Total population surplus peaks in this period with nearly 90 million people more per year. 
1988	Basel I Accord	International regulation accord, ratified by signing governments	Supervision entity setting recommendations for banking regulations. Basel I set minimal capital requirements for banks against credit risks.
1988	Can the Subaltern Speak?	Gayatri Chakravorty Spivak 	Although Spivak acknowledged the "epistemic violence" done to Indian subalterns, she suggested that any attempt from the outside to ameliorate their condition by granting them collective speech invariably will encounter problems. By speaking out and reclaiming a collective cultural identity, subalterns will re-inscribe their subordinate position in society. 
1988	Global warming	James Hansen	His speech before Congress, on June 23, is a seminal moment in bringing the threat of global warming to the public’s attention. He stated that the evidence of the green house gas effect was 99% certain and called for immediate action.
1988	Morris worm 	Robert T. Morris	One of the first recognized worms to affect the world's nascent cyber infrastructure. It used weaknesses in the UNIX system and replicated itself. The worm was the work of Robert T. Morris, who said he was just trying to gauge how big the Internet was. Now a professor at MIT, he was the first person convicted under the the US Computer Fraud and Abuse Act.
1989	Exxon Valdez Oil Spill		On March 24, the 301 meter long oil tanker Exxon Valdez ran aground a reef in Alaska, causing one of the most devastating oil spills of all times. The event gained notoriety not only because the oil spill happened in a volatile natural habitat but also because of the way how the company managed to evade its responsibility paying only a comparatively minor fine in the end.
1989	Fall of the Berlin Wall		The opening of the border between East and West Berlin on November 9, 1989 signalled the end of Soviet Communism, and was seen as the beginning of a "new world order" and "the end of history" by conservative commentators.
1989	GNU General Public License (GPL)	Richard Stallman, Eben Moglen	This license established the legal framework for Free Software, guaranteeing the right to use, share, modify and share modifications of software. This served as a template for many subsequent alternatives to informatic commodification and the nascent informational commons.
1989	In the Network of Systems	Ars Electronica	This edition was the first large scale international exhibition to address networks as a new paradigm in art and society; showing seminal work by Lynn Hershman Leeson, Jeffrey Shaw, Roy Ascott, Ponton Media group, Station Rose, Radio Subcom and Stadtwerkstatt TV. 
1989	Love Parade	Dr. Motte	Love Parade started as a political demonstration around peace, fun and food justice (Friede, Freude, Eierkuchen) by Berlin DJ Dr. Motte. The spirit of early techno and house emphasized egalitarianism, freedom and decentrality, opposing the cult of the DJ, promoting free love and peaceful anarchy.
1989	Tiananmen Square Massacre		On June 3, the Chinese government started the violent repression against the pro-democracy movement that had begun with student-led protests in April. This set China on the course of authoritarian nationalism which required rapid economic expansion to maintain political stability. 
1989	World Wide Web	Tim Berners-Lee	Hypertext Transfer Protocol (HTTP), the technology underlying the World Wide Web, was developed by Tim Berners-Lee at CERN. His proposal should allow scientists to share papers more efficiently. After first successful communication between a HTTP client and server the CERN website opened in 1990.
1990	City of Quartz	Mike Davis	A master piece of urban sociology which analyzed Los Angeles as a paradigmatic metropolis governed by simulation. Davis analysed and described how the making of myths about the city reinforced urban processes such as fragmentation, degeneration and gentrification.
1990	Dak'Art		First African Art Biennial. Initially alternating between visual art and literature, it as since focussed exclusively on "Contemporary African Art". Referencing Léopold Sédar Senghor’s “First World Festival of Negro Arts”(1966), the biennial is closely bound up in the rhetoric of contemporized pan-Africanism, yet it also connected to the globalized field of contemporary art. 
1990	Electronic Frontier Foundation (EFF)	Mitch Kapor, John Perry Barlow, John Gilmore	The Electronic Frontier Foundation, founded in July 1990 in response to a basic threat to free speech, is the leading nonprofit organization defending civil liberties in the digital world and ensuring that rights and freedoms are enhanced and protected as our use of technology grows. 
1990	Flexible accumulation	David Harvey	New systems of marketing and production, characterized by more flexible labour processes, coupled with revival of entrepreneurialism, cultural turn to postmodernism and increased precarity for workers; became the dominant labour regime in informational capitalism.
1990	Gender Trouble	Judith Butler	Book that introduced the notion that gender is performed, and therefore a dynamic dimension of identity. Foundational for queer studies and the increasingly widespread fluid conceptualization of gender and sexuality.
1990	German Reunification		The process of German Reunification began with the fall of the Berlin Wall in 1989 and was concluded by the German Democratic Republic formally joining the Federal Democratic Republic on October 3, 1990. This effectively ended all hopes that had been harbored by leftists in East Germany for a chance to develop a Third Way. Economically it meant the annexation of East Germany (see Treuhandanstalt).  
1990	Gulf War		The Gulf War (August 2, 1990 - February 28, 1991) was a war between an US-led coalition and Iraq in response to Iraq's occupation of Kuwait. It was accompanied by various technological and media "innovations" such as live frontline reporting by CNN, the notion of "smart bombs" and the introduction of the "bomb eye's view", a camera located in the head of a missile showing images from the approaching target.
1990	Human Genome Project	US National Institute of Health (NIH) and the Department of Energy with international partners	Start of the effort to sequence all 3 billion letters, or base pairs, in the human genome, successfully concluded in 2003. All data generated was made available freely on the Internet underpinning the fact that the Humane Genome Project was a major step in analysing life as an informational system. The Human Genome Project is part of a microbiology revolution, potentially initiating the next techno-economic paradigm after the information revolution.
1990	Lean Production 		The advantages of new production methods pioneered by Toyota are recognized in a MIT study published as a book. Lean Production becomes the new global norm in industry. 
1990	Treuhandanstalt: Economic Reunification of Germany		Although created when the German Democratic Republic was formally still independent, the Treuhandanstalt's job was to oversee the privatization of East German industry and business; according to critics, it acted like a corporation performing a hostile takeover, resulting in near complete destruction of the industrial base of the former GDR. 
1991	Algerian Civil War		In December, after the new and popular Islamist party, the Islamic Salvation Front (FIS), was poised to win the elections, a military coup occurred. A civil war started slowly, took up ferocity in the coming years, killing between 100.000 and 250.000 people. It ended 2002. A splinter group rejected the peace accord and pledged support to al-Qaeda.  
1991	Economic liberalization in India	Narasimha Rao (Prime Minister)	In a series of economic reforms, India changed course from a semi-socialist economy towards a neoliberal paradigm integrating it into world economy, in particular as a provider of outsourced services. Bangalore turned into a global IT hub.
1991	Information Super Highway 	Al Gore	The passing of the "High Performance Computing Act" (HPCA) on December 9, marked the beginning of significant investment in the Internet and gradually turned it into a public utility. It became the founding act for what then was called "The Information Super Highway." 
1991	Linux	Linus Torvalds	Linus Torvalds released the first version of Linux, a free version of Unix. The success of Linux sparked the Free, Libre and Open Source Software revolution and made commons-based peer production an attractive alternative to the traditional ways of working.
1991	Pretty Good Privacy (PGP)	Phil Zimmerman	The first easy to use encryption program. In 1993 its creator became the target of a criminal investigation for allegedly breaking US export regulations concerning cryptography. This was the starting point of the “Crypto Wars” a struggle between the US Government which was trying to inhibit the widespread use of strong crypto, and those who advocated its usage as a civil right. 
1992	GLOBEX	CME Group	Contrary to trading floors where human traders negotiate prices by open outcry, GLOBEX facilitates electronic access to a wide array of markets globally. While human error declined, fat thumb incidents, glitches and cancelled trades occur regularly. Conceived in 1987, this electronic trading platform was launched in 1992. 
1992	Maastricht Treaty	.	The Maastricht Treaty, signed on February 7, 1992, created the European Union and the legal basis for the introduction of the euro. It had been preceded by fierce debates between France and Germany. The latter only agreed to the common currency on the condition that tight fiscal policies were adopted. States agreed to an annual deficit of no more than 3% and a debt to GDP rate of less than 60%. Almost all countries have broken these rule since then.
1992	Mosaic (first web browser)	NCSA, Marc Andreessen	Mosaic, a multiplatform browser developed at National Center for Supercomputing Applications (NCSA) by Marc Andreessen, became the first widely used browser. Andreessen went on to become the founder of Netscape. 
1992	Point-of-Sale Software	Martin Goodwin, Bob Henry	The first point of sale software (POS) that could run on the Microsoft Windows platform IT Retail. The development of all-in-one POS technologies in retail handles customer-based functions, but more importantly exerts management control functions on members of staff.
1992	Raqs Media Collective	Jeebesh Bagchi, Monica Narula and Shuddhabrata Sengupta	Raqs became co-founders of the Sarai program at the Centre for the Study of Developing Societies in 2000; together with Sarai they edited the Sarai Readers book series. In the early 2000s, their work focused on the digital commons from a post-colonial perspective, resulting in Opus, Raqs' contribution to Documenta 11. Since then, Raqs Media Collective have become internationally recognized contemporary artists.
1992	Rio Declaration on Environment and Development	UN	Signing of the first global treaty aimed at reducing carbon emmission in order to avoid climate change. The event was not only of ecological significance but appeared to point to the possibility of global democracy.
1992	SOD	jodi.org	Jodi, or jodi.org, is a collective of two internet artists: Joan Heemskerk and Dirk Paesmans. SOD is one of the earliest artworks engaging with computer games. A severe modification of the MS-DOS game Wolfenstein 3D (1992) deconstructed it into a hyper-minimalist black-and-white maze of geometric forms and pixel patterns.   
1993	A Rape in Cyberspace	LambdaMOO	This describes a “cyberrape” in a multi-player computer game or MUD called LambdaMOO, the repercussions of this act on the virtual community and subsequent changes to the design of the MUD program. LambdaMOO, which is a virtual community still in existence, allows players to interact using avatars.
1993	Automated guided vehicles		The development of unmanned Automated Guided Vehicles came into use in the port of Rotterdam. They are controlled by a computerized Process Control System; by minimizing the role of humans, it forms an important step in making sea-to-land connections in global logistics chains less prone to strikes.
1993	Clipper Chip	NSA	A backdoor that should have been built into all communication devices to allow US secret services access to encrypted communication. It was defeated after strong opposition by civil society, most notably the EFF.
1993	Cyberwar is coming		The publication of the Rand corporation study "Cyberwar is coming" announced the beginning of a new paradigm of networked conflict. The study claimed that in asymmetrical warfare a supposedly inferior, but networked and decentralized opponent could create serious trouble for traditional military organizations. 
1993	First World Trade Center Bombing 		The bomb attack on the World Trade Center was the first severe act of terrorism on U.S. soil carried out by extremists trained in an al-Qaeda training camp in Afghanistan.
1993	Interactive Plant Growing	Christa Sommerer, Laurent Mignonneau	In this interactive installation, a 3D garden of plants is growing in interaction with viewers/participants who touch real plants; exemplary for a new type of interactive work using high-end computing and concepts such as Artificial Life; other works of a similar kind, also produced at Institute for New Media, Frankfurt/M, were Terrain 01, Ulrike Gabriel, and Dialogue with the Knowbotic South by Knowbotic Research.
1993	Next Five Minutes		This conference in Amsterdam in January 1993 inaugurated the discourse on "tactical media" in connection with the "camcorder revolutions." Followed by three more conferences in 1996, 1999 and 2004, N5M opened the discussion on the political implications of low cost electronic media and the net.
1993	WIRED	Louis Rossetto, Jane Metcalfe	With its fascination for cyberspace, digital technology, new economy and libertarian policy, it became the cult magazine of the 1990s. The strongest influence on its editorial outlook came from techno-utopian Stewart Brand, long time chief editor Kevin Kelly and Nicholas Negroponte from MIT Media Lab. Headquartered in San Francisco, it was called the "zentralorgan" of the Californian ideology, a fertile ground for free-market ideas.
1994	Amazon.com		Amazon.com, founded on July 6, 1994 in Seattle, Washington, is the largest Internet-based retailer in the United States. As of 2015 it is the world's largest provider of cloud computing services.
1994	Bangemann Report	Martin Bangemann	The Bangemann Report on "Europe and the Global Information Society" sets Europe on to a neoliberal and corporate digital future, by talking only about e-commerce, e-government, pay-TV and on-demand services; ignores all the potential benefits of emancipatory peer-to-peer communications.
1994	Chiapas Uprising: Networked Conflict	Subcomandante Marcos	On the January 1, 1994, the previously unknown indigenous army “Ejército Zapatista de Liberación Nacional” (Zapatista's Army of National Liberation - EZLN) entered several cities in Southern Mexico in an armed uprising, because the North America Free Trade (NAFTA) agreement threatened their livelihood. This marked the beginning of the first globalized networked conflict in the neoliberal era. 
1994	Digital Zapatismo	Subcomandante Marcos	Three days after the Chiapas uprising, on January 3, Subcomandante Marcos addressed a global audience directly from out of the Lacandono jungle by using a network connection. This marked the coming true of the prediction of netwar, a new type of asymetrical conflict where network communications play an increasingly important role.
