1994	End of Apartheid in South Africa 	Nelson Mandela	The election of Mandela as President ended, in effect, the regime of racial segregation that was officially introduced in 1948, but had roots at the beginning of the colonial era in the late 18th century. It also enabled the integration of South Africa into the world economy and the formation of the BRICS countries.
1994	GeoCities		First free "social network" with 15 MB free space. Yahoo bought the Web community site for 3.6 billion US$ in 1999.
1994	NAFTA Treaty		This treaty was to eliminate barriers to trade and investment between the U.S., Canada and Mexico. The first, major international trade treaty of what would grow over the next three decades into a global, neoliberal economic regime. 
1994	Peso Crisis (Mexican Financial Crisis)		Mexican financial crisis – first of the big recent developing country financial crises. It turned Mexico into a laboratory for the "austerity medicine" administered by the IMF. 
1994	W3 Consortium	Tim Berners-Lee et al.	In 1994, the W3 Consortium was formally established. It oversees development of the web technology standards and promotes web interoperability.
1994	Yahoo! 	Jerry Yang, David Filo	Yahoo! which stands for “Yet Another Hierarchically Organized Oracle” globally amplified the fact that students can create a multinational company out of their dormitory.  Yahoo! survived to this date offering virtual community functions that transfer earlier Internet community oriented technologies to the WWW. 
1995	Apache Webserver		In 1995, the widely and most popular open source webserver Apache was released. As of 2015, it serves 50% of the worldwide active websites.
1995	Brent Spar	Shell, Greenpeace	Brent Spar E was an oil storage and loading facility in the North Sea. Once it was no longer needed for operations, Shell planned to sink it. Greenpeace mounted an extensive campaign against that and forced Shell to agree to the more expensive on-shore disposal, even though it had been approved by the UK government. A major victory for the European environmental movement. 
1995	Browser Wars (Internet Explorer 1) 	Microsoft	Microsoft, widely regarded as having missed the Internet revolution, released version 1.0 of Internet Explorer launching the "browser wars" with first Netscape, later Mozilla, leading to countless interoperability problems for websites because of proprietary technologies.
1995	First Netstrike	Tommaso Tozzi / Stranonet	The first Netstrike, on Dec 21, 1995, marks the first known act of electronic civil disobedience carried out as a cultural form of protest. French government webservers were targeted simultaneously with French embassies in protest against French nuclear tests in the Mururoa Atoll.
1995	GPS (Global Positioning System)	US Department of Defence	US Department of Defence project with initially 24 satellites, declared a dual use project by Bill Clinton and since has become widely used. Presently does not discriminate civilian users by giving them worse data. A number of new systems under development by EU, Russia, India.
1995	Netscape IPO	Marc Andreessen, Netscape developer, Jim Clark, founder	The Initial Public Offering on September 8, 1995 of Netscape, a company distributing a free Internet browser, resulted in a market value of US$ 2.9 billion. This marked the beginning of the Dot-Com era aka the New Economy, a stock market driven economic expansion which ended in 2000. 
1995	Nettime	Geert Lovink, Pit Schultz, Felix Stalder, Ted Byfield	The mailing list nettime was established as a forum for net critique – a critical discourse on the net from within the net. Over the years, nettime grew to 4500 subscribers and it is still ongoing, still influential and remains one of the longest running independent online projects.
1995	Ogoni Resistance	Ken Saro-Wiwa	The writer and civil rights activist was executed following a political trial by the Nigerian government. He had lead a non-violent campaign by the Ogoni people against the extreme environmental damages caused by oil extraction, mainly by Royal Dutch Shell, in their homeland Niger Delta. 
1995	Schengen Agreement	European Union	Although signed in 1985, the agreement came into force only in 1995; Abolished border controls between signatory states, but necessitating more rigorous control of external borders, accompanied by introduction of the Schengen Information System (shared secret police data base on migrants, football hooligans and political activists).
1995	Virtual Reality Markup Language (VRML)		VRML became the first web based 3D format. At Siggraph 1997 VRML was promoted as if the Internet would be turned into three-dimensional cyberspace, a prophecy that has failed to materialize at the time of writing (2015).
1995	Wiki	Ward Cunningham	A wiki is a website where each reader can become a writer and change each page. The Wiki principle restored some of the original ideas behind the WWW, as it was heading for its commodification.
1996	A Declaration of the Independence of Cyberspace	John Perry Barlow	This manifesto was published on February 8, 1996 in response to the "Telecommunication Act of 1996" in the USA, arguing against Internet regulation and that governments “have no sovereignty” online. It deals with the struggle between individual freedom and oppression by political and corporate forces. 
1996	Attempted Censorship of Radikal Magazine 	German State Prosecutor	The German state prosecutor ordered Internet service provider to block access to Dutch ISP xs4all which hosted the website of leftwing Radikal magazine. After public protests and numerous mirror sites, the order was taken back.
1996	Dolly the sheep	Ian Wilmut, Keith Campbell	Dolly the sheep, the first mammal to be cloned from an adult somatic cell, created a huge media response making it look as if a new level of biotechnology and cloning was just around the corner.
1996	RTMark: Sim Copter Hack	RTMark	In 1996, ®TMark channeled $5000 from a New York shopkeeper as a reward to a Silicon Valley programmer for creating a digital "prank" in SimCopter, a commercial computergame. According to the artists, 80,000 copies of the game were distributed before the hack was discovered.
1996	Telecommunications Act		This legal framework signed on February 8, by Bill Clinton, fostered deregulation of the converging broadcasting and telecommunications markets and was the first step to a global e-commerce market. It was also the first bill signed in cyberspace.
1996	The Internet Archive	Brewster Kahle	The Internet Archive is founded under the slogan "Universal access to human knowledge". As of 2014, the archive provides access to 18.5 Petabytes of texts, audio, moving images, software and archived web pages. The "Wayback Machine" facilitates the retrieval of time-stamped snapshots of the archived Web pages.
1996	Viagra (Sildenafil)	Pfizer	The drug is used to address erectile dysfunction. Important step in making functional enhancement through drugs mainstream.
1996	WIPO Copyright Treaty		This treaty set the international framework for ever harsher copyright laws, empowering rights holders at the expense of the public and rights for free use. It was implemented in the US in the Digital Millennium Copyright Act (1998) and the EU Copyright Directive (2001).
1996	Workfare	Bill Clinton	The "Personal Responsibility and Work Opportunity Reconciliation Act" promised to "end welfare as we knew it." The bill introduced a lifetime limit of five years for benefit eligibility, compulsory attendance at unpaid jobs in return for benefits and heavy sanctions for non-attenders. Similar programs were later introduced by "third-way socialists" such as Tony Blair in the UK and Gerhard Schröder in Germany.
1997	Asian Financial Crisis		The bursting of a real estate bubble in Thailand triggered the Asian Financial Crisis as investors withdrew short-term capital from emerging economies. This reaction caused a severe and sharp financial and economic crisis in one Asian country after another. Biased Western media reporting blamed Asian "crony capitalism" for the crisis. It spread quickly to Brazil, Russia and Argentine. IMF administered austerity policies caused a "Return to Depression Economics" (Paul Krugman).
1997	Cities on the Move (exhibition)	Hou Hanru, Hans Ulrich Obrist	An influential exhibition that was one of the first to grapple with the impact of globalization and hyper-urbanization. Asian mega-cities were defined as the backdrop necessary for the understanding of contemporary Asian art. Showing contemporary architecture and art from Asian cities, the exhibition reflected in which ways different conceptions of western ideas of ‘modernity’ and utopia might be at play in today’s ‘East’.
1997	d x: Documenta 10	Catherine David	Attempted an appraisal of 30 to 40 years of critical conceptual and contemporary practices, reconnecting audiences with key works by, for example, Hans Haake and Gordon Matta-Clark. Presented Makrolab, an electromagnetic research station founded by Marko Peljhan, and allowed "Hybrid Workspace" to happen, a nettime moderated open art and activism lab used by different groups for a couple of weeks. 
1997	Dublin Convention		The Dublin Convention was introduced by EU members and some associated nations to curtail the options of refugees to seek asylum where they find it desirable and force them to do so in the nation which was their first port of call. This shelters the rich Northern nations from influx of unwanted migrants while it puts the greatest burden on poorer border nations. The system effectively collapsed during the refugee crisis in 2015.
1997	Electronic Communication Networks (ECNs)	Jeff Citron and Josh Levine 	Founded in 1996, Island became the first ECN for trading stocks electronically outside exchanges. ECNs were instrumental for breaking the dominant influence of financial power elites by providing easy and cheap access to trading. They mark the outset of the proliferation of algorithmic trading, virtual exchanges and dark pools.
1997	Immaterial Labor	Maurizio Lazzarato	The term immaterial labor denotes a change in working practices in the wake of the transition from Fordism to informationalism. Refers to new working practices inside corporations as well as activities usually not recognized as labor that create brand value. 
1997	Introduction to net.art	Alexei Shulgin & Natalie Bookchin	This served as a tongue-in-cheek manifesto for the net.art scene of the 90’s. It offered a simplified beginners' guide to net.art, followed by DIY instructions on how to become a net artist. In 1999 this text was exhibited engraved in stone. This piece effectively embodies the transgressive, and humorously self-aware style of the early net.art
1997	Kyoto Protocol	UN	The Kyoto Protocol, adopted on December 11, is an international agreement which commits its parties by setting internationally binding emission reduction targets. It is based on the recognition that industrial countries have a higher responsibility for the reduction of greenhouse gases. However, it also paved the way for carbon emission trading.
1997	New Labour Election Victory and Third Way Socialism 	Tony Blair, Gerhard Schröder, Romano Prodi, Bill Clinton	After winning an absolute majority in general elections on May 1, 1997, Tony Blair became the most vocal of so-called "Third Way Socialists" who combined fiscal conservativism (an economic doctrine of the political right), with modest social and cultural liberalism. Third Way Socialists continued the dismantling of the welfare state begun by Thatcher and Reagan and paved the way for the growth of a financialized economy dominated by stock exchanges. 
1997	Sensation (exhibition)	Charles Saatchi and the YBAs	The Young-British-Artists (YBAs) who went through their formative years during Thatcherism are shown in a seminal exhibition at the Royal College put together by the collector and gallerist Charles Saatchi, one half of advertisement agency Saatchi & Saatchi. Sensation celebrated the new marriage of art and finance and marks an early high point of the rapid expansion of the art market and increasing role of speculative capital.
1998	Anti-social behaviour order (ASBO)	Tony Blair	A new type of civil order introduced in the UK against people who have shown "anti-social behavior" but which wasn't severe enough to warrant criminal prosecution. ASBOs revealed the illiberal core of Blair's Third Way socialism.
1998	Astrobiology Roadmap	NASA	NASA's Ames Research Centre is increasingly involved in designing and funding research into extreme life forms and microbial bioremediation. This is about recreating life beyond its limits. The importance of the NASA program lies in the translational role it is playing between speculative science and (post)industrial applications.
1998	Bailout of Long Term Capital Management  (LTCM)	John W. Meriwether	LTCM was a hedge fund whose board of directors included Nobel Prize winners Myron Scholes and Robert Merton. The fund was initially successful but lost $4.6 bn in less than four months in the wake of the financial crises in Asia (1997) and Russia (1998). Due to high leverage financing, its collapse threatened the entire financial system. The U.S. Federal Reserve – led by its chairman Alan Greenspan – and the major global investment banks agreed to bail out LTCM with a $3.6 bn recapitalization. 
1998	Electronic exchanges authorized	US Securities and Exchange Commission (SEC)	Electronic exchanges use information technology to create virtual marketplaces. Algorithmic and other alternative trading systems have changed the financial infrastructure radically. While algorithms were already used by large market players to control price execution, new firms appeared that took advantage of speed and low latency by making small profits per trade with high trading volume.
1998	First female CEO in the Internet era	Meg Whitman	She became the first female CEO of the new economy IT sector (a notoriously male dominated business field). eBay had 30 employees and $4 million in revenues when she started. She left the company in 2008 when it had 15,000 employees and $8 billion in annual revenues.
1998	Google, Inc.	Larry Page, Sergey Brin	Google was incorporated based on a university research program. Within the space of a few years Google established itself as the world's most popular web search engine based on their innovative search algorithm (page rank). Since then, expanded into ever larger number of fields and has become the world's most valuable company in 2016. 
1998	Great War of Africa		The Second Congo War began; 3,900.000 people were killed before it ended in 2003, making it the bloodiest war, to date, since World War II. A significant part of the war was financed through the mining of "conflict-minerals" used in the global IT industry, such as gold, copper and coltan.
1998	Human embryonic stem cells research	James Thomson, Jeffrey Jones	A team at the University of Wisconsin, Madison, led by James Thomson and Jeffrey Jones, reports the creation of the first batch of human embryonic stem cells, which they derived from early embryos (Nov 6, 1998) kickstarting hopes in new forms of medical research and Life Science industries. 
1998	International Space Station (ISS)	5 space agencies	The International Space Station is the largest and most complex human construction in outer space and the only one that can be seen by the naked eye. This most advanced attempt to date to create a permanent settlement in space could prefigure future voyages to Mars. Most importantly, it is not a national effort but an international cooperation of more than a dozen countries, including the US and Russia, making exploration of space a universal human topic. 
1998	PayPal		PayPal was founded in 1998 as a worldwide online payment system, providing critical infrastructure for e-commerce and a means to transact global payments for average users.
1998	SYNWORLD playwork:hyperspace	public netbase / Konrad Becker	This was one of the first large exhibitions dedicated to the relationship between Art and Computer Game Culture. “Synreal: The Unreal Modification” was part of the main exhibition, and it is now remembered as one of the first collective shows where artists were invited to create Game Art-based installations.
1998	US Embassy Bombings and the Rise of Islamic Terrorism		The bombing of the US embassies in Nairobi, Kenya, and Dar es Salaam, Tanzania, brought Osama Bin Laden and Al-Qaeda to the notice of the world public. 
1999	B92 Serbian Independent Radio 		With the support of a European network of media activists, the independent radio station was able to broadcast through the bombing of Belgrade, counteracting both state and NATO propaganda.
1999	Bologna Declaration	Ministers of Education of 29 European countries 	The “European Higher Education Area” was established with the aim to achieve greater compatibility and comparability between the different national systems. This standardization process with BA, MA and PhD introduced a European knowledge market and expanding the global business with student fees. The effects of the “industrialization of education” were widely criticized in various student protest movements in the following years.
1999	Consume	James Stevens	First workshops of the wireless community experiment Consume. The project aimed at creating wireless peer-to-peer networks. While Consume petered out in the 2000s, similar initiatives such as Freifunk, Germany, and Guifi, Spain, became large scale alternative network providers creating a wireless commons. 
1999	DeCSS	Jon Lech Johansen	One of the first free softwares to decrypt content on commercially produced DVD discs. DeCSS release resulted in a criminal trial of the authors, the DVD Copy Control Association (CCA) launched numerous lawsuits in the US in an effort to stop its distribution. 
1999	Gramm-Leach-Billey Act		Revocation of the Glass–Steagall Act, an important element of the regulation of the financial industry introduced after the 1929 crash. The deregulation lead to series of mergers of commercial and investment banks and played a major role in creating massive financial institutions and the risks at the heart of the global financial crisis of 2008.
1999	Indymedia		In the context of the "Battle of Seattle" between Nov. 29 and Dec. 3, an independent media center was created to facilitate a counterweight against biased reporting by mainstream media. This marked the launch of the global Indymedia network.
1999	Institutional Racism	Stephen Lawrence, Sir William McPherson	The MacPherson Report into the inquiry of the murder of black teenager Stephen Lawrence concluded that the London Metropolitan Police had been "institutionally racist". Forced the Met to reconsider its policies; first official admission in Europe of institutional racism. 
1999	Introduction of the Euro 	European Central Bank	The new currency was introduced in non-physical form on January 1 by the European Central Bank (ECB) which had been established in the previous year. The currencies of participating countries (the euro zone) were locked at fixed exchange rates against each other. In 2002 the Euro was introduced as physical coins and bills. The Euro reflects the construction of the ECB, which was set up to be independent from direct government influence, with the primary mandate to maintain price stability. 
1999	J18 - Carneval Against Capitalism	Reclaim the Streets	The anarchist network Reclaim the Streets organized a global action day against the increasing power of financial markets on June 18, 1999 (hence J18). Taking the authorities by surprise, 50.000 celebrate a street party in the City of London without the police being able to intervene for several hours. 
1999	Launch of Natural Reality SuperWeed Set 1.0	irational.org, Heath Bunting	It claimed to be a "superweed" genetically engineered to attack commercial agricultural monocroppings. Advertised as being resistant to herbicides such as "Roundup", a version 2 of the set will be released with "more offensive capabilities", should there be no national ban on genetically manipulated crops in the US.
1999	Napster	Shawn Fanning	Established the concept of file sharing and the practice of massive copyright violation. While it was shut down in mid 2000, the practice grew even more popular in the coming years, thanks to new, decentralized technologies such as BitTorrent.
1999	NATO Bombing of Yugoslavia	NATO, Slobodan Milošević	During the Kosovo War, NATO started a bombing campaign against Yugoslavia without a UN mandate on behalf of "humanitarian interventionism" – a military intervention with the aim of stopping war crimes from happening.
1999	Start of the Euro zone		Eleven European countries introduce a common currency, the euro, in non-physical form at midnight on January 1, 1999, thus forming the euro zone (the national currencies disappear at the start of 2002 when the euro became legal tender). The euro is managed and administered by the Frankfurt-based European Central Bank (ECB) and the euro system (composed of the central banks of the euro zone countries).
1999	Toy War	Etoy	The conflict about the domain name etoy/s between the Swiss Austrian artist group Etoy and the online retail group Etoys is presented as a "battle for the soul of the net." It is an early example of a type of political net art that uses tactical media and media hacking strategies in an asymmetric conflict against a superior opponent. 
1999	World Population 6 Billion people		Average annual rate of population change in the period 1995-2000: 1,32% It took 12 years to go from 5 Billion (1987) to 6 Billion people.  
2000	"Widerstand" – Resistance against ÖVP-FPÖ coalition in Austria   		On February 4, the first of a series of large demonstrations blocked the newly formed ÖVP-FPÖ government in its traditional walk from prime minister's office to president palace. Very large demonstrations were held the next days, and smaller ones for the next months and years, mostly Thursdays. This was the first political mass movement in Austria that used mobile phones and the internet as core organizational tools.
2000	Anthropocene	Paul Crutzen, Eugene F. Stoermer	A term (re-)coined by ecologist Eugene F. Stoermer in the 1980s. The term claims a new geological epoch due to the influence of human behavior on the earth's geology and ecosystems. As of August 2015, the term is not officially accepted into the nomenclature of geology, but is widely used by interdisciplinary researchers and artists.
2000	Deep Web	Mike Bergman	The term "Deep Web" refers to content of the WWW which is not indexed by search engines and thus only searchable through proprietary means. This includes, amongst others, paywalled, dynamic or archival content.
2000	Empire (The Multitudes)	Toni Negri and Michael Hardt	The book became an instant theory bestseller. It popularized the notion of the multitudes as a replacement of the working class to account for all those workers outside traditional wage labour relations, i.e. women, precarious workers, indigenous communities, grey market workers, refugees.
2000	End of Dot-Com Boom		The opening of the Internet for public usage and the introduction of new business models resulted in a stock market boom throughout the second half of the 1990s. When it peaked and ended in spring 2000 massive amounts of infrastructure had been created and large sections of the population had started to use the Internet. The crises of the media companies did not slow down the growing importance of the Internet for all sectors of society.
2000	Gaussian copula function	David X. Li	Industry standard for the pricing of Collaterialized Debt Obligations (CDOs). The formula was used to trade risk tranches even though they were not correlated. This led to vast amounts of new financial products and the financial markets expanded enormously. The CDO market alone grew to 100s of billions of US$ at the peak of the bubble. These complex derivatives collapsed in the 2007 subprime crisis which triggered the financial crisis of 2008.
2000	Intercontinental Exchange (ICE, owner of “Wall Street” since 2013)	Jeffey C. Sprecher	Founded by energy specialist Jeffey C. Sprecher who was backed by energy traders (Goldmann Sachs, Deutsche Bank, Shell, Total…), ICE quickly expanded into commodities, foreign exchange and other financial businesses. ICE has been the US Federal Reserve’s clearing house since the financial crisis. Among its 23 exchanges is NYSE Euronext (acquired for $8.2 billion in 2013). 
2000	Lisbon Treaty		The Treaty of Lisbon was, after Maastricht, the decisive step of the EU to form an economic regional power block which sought to turn itself into  the "most competitive and dynamic knowledge based economic region in the world." 
2000	Y2K Millennium Bug		Widely discussed fear of computer-related problems to occur due to the practice of truncating the year dates in computer programs to 2 digits, interpreting 2000 as 1900. It brought to public attention the degree to which contemporary society has become dependent on computers.
2001	Anti-G8 Demo in Genoa	Carlo Giuliani	The G8 conference held on July 21-22 in Genoa, Italy, turned into a nightmare when the police shot Carlo Giuliani, and attacked the sleeping base of Indymedia, after initiating large scale riots by agent provocateurs. The Berlusconi regime showed a new tough approach to leftwing protests, foreshadowing the post 9/11 world.
2001	BitTorrent	Bram Cohen	BitTorrent is a distributed file sharing protocol whose innovation lies in its ability to disperse the download of files across multiple sources. This feature made it very popular in (illegal) file-sharing communities because it was initially argued that the download of only a chunk of a copyrighted content can't be regarded as illegal distribution.
